{
 "schema_version": 1,
 "tree_hash": "git-tree:4b825dc642cb6eb9a060e54bf8d69288fbee4904",
 "created_at": "2026-10-16T12:00:00Z",
 "items": [
  {
   "id": "esc-0a1b2c3d4e5f",
   "kind": "behavior_divergence",
   "target": "src/lib/routes.ts::tabToPath",
   "summary": "The function returns another path for playground.",
   "evidence": {
    "counterexample": {
     "args": "[\"playground\"]",
     "old": "\"/app/playground\"",
     "new": "\"/app/connect\""
    }
   },
   "resolve_with": [
    "enforce_new_behavior"
   ]
  },
  {
   "id": "esc-1a2b3c4d5e6f",
   "kind": "test_without_teeth",
   "target": "tests/test_calc.py::tests.test_calc::test_media_vacia",
   "summary": "The new test passes on the base with stubs: it does not prove the change.",
   "evidence": {
    "base": "passed",
    "candidate": "passed"
   },
   "resolve_with": [
    "characterization_test"
   ]
  },
  {
   "id": "esc-2a3b4c5d6e7f",
   "kind": "flaky_test",
   "target": "tests/test_red.py::tests.test_red::test_lento",
   "summary": "Flaky on the base: quarantine is proposed.",
   "evidence": {
    "base": "passed",
    "candidate": "failed",
    "reruns_base": [
     "failed",
     "passed",
     "passed"
    ]
   },
   "resolve_with": [
    "quarantine_flaky"
   ]
  },
  {
   "id": "esc-3a4b5c6d7e8f",
   "kind": "tooling",
   "target": "tests/test_nuevo.py::tests.test_nuevo::test_x",
   "summary": "Failure on the base due to import: missing stub.",
   "evidence": {
    "base": "error",
    "message": "ModuleNotFoundError: No module named 'src.new'"
   },
   "resolve_with": []
  },
  {
   "id": "esc-4a5b6c7d8e9f",
   "kind": "behavior_divergence",
   "target": "tests/test_abs.py::tests.test_abs::test_media_negativos",
   "summary": "Red in the candidate, green in peer:a1b2c3d4.",
   "evidence": {
    "trees": {
     "base": "failed",
     "candidate": "failed",
     "peer:a1b2c3d4": "passed"
    },
    "message": "AssertionError: media([-1, -3]) == -2"
   },
   "resolve_with": [
    "enforce_new_behavior"
   ]
  },
  {
   "id": "esc-5a6b7c8d9e0f",
   "kind": "uncovered_change",
   "target": "src/calc.py::*",
   "summary": "2 changed lines that no engine examined and no test ran.",
   "evidence": {
    "lines": [
     20,
     21
    ]
   },
   "resolve_with": [],
   "needs": {
    "role": "saboteur",
    "artifact": "test_files"
   }
  }
 ]
}
