{"schema_version": 1, "tree_hash": "git-tree:4b825dc642cb6eb9a060e54bf8d69288fbee4904", "created_at": "2026-10-17T12:00:00Z",
 "items": [
  {"id": "esc-5d1c0f3a9b7e", "kind": "mutant_survived", "target": "src/calc.py::mutant:m002",
   "summary": "Live mutant at line 15 (constant): no test in T kills it; kill_rate 0.67 < 0.80.",
   "evidence": {"mutant": {"id": "m002", "file": "src/calc.py", "line": 15, "operator": "constant", "description": "numeric constant changed: +1"}},
   "resolve_with": [],
   "needs": {"role": "saboteur", "artifact": "test_files"}}]}
