{"schema_version": 1, "tree_hash": "git-tree:4b825dc642cb6eb9a060e54bf8d69288fbee4904", "created_at": "2026-10-17T12:00:00Z",
 "items": [
  {"id": "esc-0a1b2c3d4e5f", "kind": "behavior_divergence", "target": "tests/test_o.py::c::to",
   "summary": "The candidate fails a test that another tree passes: red here, green in peer:9d45962e.",
   "evidence": {"trees": {"base": "failed", "candidate": "failed", "peer:9d45962e": "passed"}, "message": "assert f(2) == 4"},
   "resolve_with": ["enforce_new_behavior"], "cluster_id": "clu-5e6f7a8b9c0d", "builder": "builder_primary"},
  {"id": "esc-1a2b3c4d5e6f", "kind": "behavior_divergence", "target": "tests/test_p.py::c::tp",
   "summary": "The candidate fails a test that another tree passes: red here, green in peer:4b825dc6.",
   "evidence": {"trees": {"base": "failed", "candidate": "failed", "peer:4b825dc6": "passed"}, "message": "assert f(3) == 6"},
   "resolve_with": ["enforce_new_behavior"], "cluster_id": "clu-5e6f7a8b9c0d", "builder": "builder_orthogonal"}
 ]}
